base_seg_id	lpair	source	ht	mt	src_doc_id
_DE_EN_006043-13	deen	Es ist bedauerlich, weil wir sonst übereinstimmen, aber ich bin überzeugt das möchte ich zu dem Schluss sagen , dass Sie diese Frist auch einhalten können, wenn Sie die Sozialpartner und die europäischen Gewerkschaften als Bündnispartner für die Analyse nehmen, denn die haben alle die notwendigen Daten, Defizite und Missstände bereits auf dem Tisch liegen.	This is regrettable, as we otherwise agree, but I will conclude by saying that I an dem convinced that this is a deadline you can meet if, in carrying out the analysis, you join with the social partners and the European trades unions, who already have the necessary data, with details of the deficits and abuses, ready to hand.	It is regrettable because we otherwise agree, but I am convinced, and I would like to conclude by saying this, that you can also meet this deadline if you take the social partners and the European trade unions as allies for the analysis, because they already have all the necessary data, deficits, and grievances on the table.	ORG_WR_DE_EN_006043
_EN_DE_003723-01	ende	There are so many things that remain to be done and so many priorities that were set down at Lisbon, Stockholm, or Cardiff that have yet to be completed, to be achieved and to be reached.	Zahlreiche Aufgaben stehen noch aus und zahlreiche Prioritäten wurden in Lissabon, Stockholm oder Cardiff festgelegt, die noch nicht umgesetzt, verwirklicht und erreicht wurden.	Es gibt noch so viel zu tun, und so viele Prioritäten, die in Lissabon, Stockholm oder Cardiff festgelegt wurden, müssen noch umgesetzt, erreicht und verwirklicht werden.	ORG_WR_EN_DE_003723
_EN_DE_003723-02	ende	We ought to focus more on improving the quality of the proposals that we put forward, ensuring that they respond to the demands and needs of the peoples of Europe, and more importantly, ensure that they lay down a solid foundation for the future development of economic prosperity, of stability and of sustainability.	Wir sollten uns vorrangig auf eine Verbesserung der von uns vorgelegten Vorschläge konzentrieren, gewährleisten, dass diese den Forderungen und Bedürfnissen der Völker in Europa gerecht werden, und, was noch viel wichtiger ist, sicherstellen, dass sie eine solide Grundlage für die künftige Entwicklung von wirtschaftlichem Wohlstand, Stabilität und Nachhaltigkeit bilden.	Wir sollten uns mehr darauf konzentrieren, die Qualität der von uns vorgelegten Vorschläge zu verbessern, damit sie den Anforderungen und Bedürfnissen der Menschen in Europa entsprechen und, was noch wichtiger ist, eine solide Grundlage für die künftige Entwicklung von wirtschaftlichem Wohlstand, Stabilität und Nachhaltigkeit schaffen.	ORG_WR_EN_DE_003723
_EN_DE_003723-03	ende	I do not believe that there is a conflict between economic development and sustainable development, nor that we cannot put in place an aggressive taxation policy to create employment, to ensure that business and industry can have a competitive environment in which to succeed and prosper, and that does not necessarily lead to the detriment of social protection, or of investment in social services like education, health and infrastructure development.	Ich bin nicht der Ansicht, dass ein Widerspruch zwischen wirtschaftlicher Entwicklung und nachhaltiger Entwicklung besteht, und ich frage mich, warum wir nicht eine offensive Steuerpolitik einführen sollten, um Arbeitsplätze zu schaffen und zu gewährleisten, dass Unternehmen und Industrie in einem wettbewerbsfreundlichen Umfeld zu Erfolg und Wachstum gelangen, was sich nicht zwangläufig nachteilig auf den Sozialschutz oder auf Investitionen in soziale Dienstleistungen wie Bildung, Gesundheitspflege und Infrastrukturentwicklung auswirkt.	Ich glaube nicht, dass es einen Konflikt zwischen wirtschaftlicher Entwicklung und nachhaltiger Entwicklung gibt, noch dass wir keine aggressive Steuerpolitik betreiben können, um Arbeitsplätze zu schaffen und sicherzustellen, dass Wirtschaft und Industrie ein wettbewerbsfähiges Umfeld vorfinden, in dem sie erfolgreich sein und prosperieren können, ohne dass dies zwangsläufig zu Lasten des sozialen Schutzes oder der Investitionen in soziale Dienstleistungen wie Bildung, Gesundheit und Infrastrukturentwicklung geht.	ORG_WR_EN_DE_003723
_EN_DE_003723-04	ende	I would certainly oppose all measures or any ideas towards harmonisation or coordination of tax policy within the European Union.	Natürlich wäre ich gegen alle Maßnahmen oder Ideen, die auf eine Harmonisierung oder Koordinierung der Steuerpolitiken innerhalb der Europäischen Union abzielen.	Ich würde mich sicherlich gegen alle Maßnahmen oder Ideen zur Harmonisierung oder Koordinierung der Steuerpolitik innerhalb der Europäischen Union aussprechen.	ORG_WR_EN_DE_003723
_EN_DE_003723-05	ende	This is an area that is exclusively within the remit of the Member State governments alone, and it is wrong and has been proven wrong many times, that, to use the simple analogy of previous eras, higher taxation means that you can spend more on social protection.	Dieser Aufgabenbereich fällt ausschließlich den Mitgliedstaaten zu, und es stimmt nicht und hat sich auch wiederholt als falsch erwiesen, dass, um auf eine einfache klassische Gleichung zurückzugreifen, in dem Falle von Steuererhöhungen Mehrausgaben in dem Bereich des Sozialschutzes möglich sind.	Dies ist ein Bereich, der ausschließlich in die Zuständigkeit der Regierungen der Mitgliedstaaten fällt, und es ist falsch und hat sich schon oft als falsch erwiesen, dass, um eine einfache Analogie aus früheren Zeiten zu verwenden, höhere Steuern bedeuten, dass man mehr für den Sozialschutz ausgeben kann.	ORG_WR_EN_DE_003723
_EN_DE_003723-06	ende	That idea has been turned on its head by the economic realities of existing Member States also by the performances of other Member States, such as in my own country in particular Ireland, where an aggressive reduction in taxation policy, reducing the cost of labour and the income tax levy and ensuring that business can survive in a harmonious industrial relations environment with the majority of the earnings that the workers are getting going into their pocket and not going into taxation; while at the same time, increasing the levels of protection that are available for those who are most vulnerable within our society and increasing investments in education and health.	Dieser Gedanke wurde durch die wirtschaftlichen Gegebenheiten in derzeitigen Mitgliedstaaten in sein Gegenteil gekehrt - auch durch die Leistungen in anderen Mitgliedstaaten, wie vor allem in meiner Heimat - Irland, wo eine deutliche Steuersenkung zu einem Rückgang der Lohnkosten und der Einkommenssteuergrenze geführt und dazu beigetragen hat, dass Unternehmen in einem Umfeld harmonischer Beziehungen zwischen den Sozialpartnern überleben können, während der Großteil der Einkünfte der Arbeitnehmer in ihre eigenen Taschen und nicht in die Steuerkasse fließt. Gleichzeitig konnte das Schutzniveau für die Schwächsten in der Gesellschaft verbessert und Investitionen in Bildung und Gesundheit erhöht werden.	Diese Vorstellung wurde durch die wirtschaftliche Realität der bestehenden Mitgliedstaaten und auch durch die Leistungen anderer Mitgliedstaaten, wie insbesondere meines eigenen Landes Irland, auf den Kopf gestellt, wo eine aggressive Senkung der Steuern, eine Verringerung der Arbeitskosten und der Einkommenssteuer sowie die Gewährleistung, dass Unternehmen in einem harmonischen Umfeld der Arbeitsbeziehungen überleben können, wobei der Großteil der Einkünfte der Arbeitnehmer in ihre Taschen fließt und nicht in die Steuern, Gleichzeitig werden der Schutz für die Schwächsten unserer Gesellschaft verbessert und die Investitionen in Bildung und Gesundheit erhöht.	ORG_WR_EN_DE_003723
_EN_DE_003723-07	ende	There is a new and different way forward that can succeed and operate for the betterment of the governments and the European Union as a whole, but most importantly for the betterment of the people.	Es gibt neue und andersartige Möglichkeiten des Vorgehens, die mit Erfolg gekrönt sein und dem Wohl der Staaten sowie der gesamten Europäischen Union, aber vor allem dem Wohl der Menschen dienen können.	Es gibt einen neuen und anderen Weg, der zum Erfolg führen und zum Wohle der Regierungen und der Europäischen Union insgesamt, vor allem aber zum Wohle der Menschen funktionieren kann.	ORG_WR_EN_DE_003723
_EN_DE_003723-08	ende	What we bring forward from the Lisbon process and the Lisbon summit, most importantly of all, is access to education, training, learning and knowledge.	Die wichtigsten Errungenschaften des Lissabonner Prozesses und des Lissabonner Gipfels sind Zugang zu Bildung, Ausbildung, Lernen und Wissen.	Was wir aus dem Lissabon-Prozess und dem Lissabon-Gipfel mitnehmen, ist vor allem der Zugang zu Bildung, Ausbildung, Lernen und Wissen.	ORG_WR_EN_DE_003723
_EN_DE_003723-09	ende	If we do not give the skills to our people in order to take advantage of new employment opportunities that are out there, then we deny them the real human and civil rights of participating fully in society.	Wenn wir unseren Bürger nicht die Fähigkeiten vermitteln, die sie benötigen, um die neuen Beschäftigungsmöglichkeiten zu nutzen, dann verwehren wir ihnen die Menschen- und Bürgerrechte, die für eine umfassende Beteiligung an der Gesellschaft wirklich von Bedeutung sind.	Wenn wir unseren Bürgern nicht die Fähigkeiten vermitteln, die sie benötigen, um die neuen Beschäftigungsmöglichkeiten zu nutzen, verweigern wir ihnen das echte Menschen- und Bürgerrecht auf uneingeschränkte Teilhabe an der Gesellschaft.	ORG_WR_EN_DE_003723
_EN_DE_003723-10	ende	If anything is to come out of the Barcelona summit, it is a re-endorsement and re-affirmation of the importance of lifelong learning and a knowledge-based society with education and training for all.	Wollen wir auf dem Gipfel von Barcelona Ergebnisse erzielen, dann müssen wir die Bedeutung des lebenslangen Lernens sowie einer wissensbasierten Gesellschaft mit Bildungs- und Fortbildungsmöglichkeiten für alle Menschen erneut bestätigen und bekräftigen.	Wenn der Gipfel von Barcelona etwas bewirken soll, dann ist es die erneute Bekräftigung und Bestätigung der Bedeutung des lebenslangen Lernens und einer wissensbasierten Gesellschaft mit Bildung und Ausbildung für alle.	ORG_WR_EN_DE_003723
_EN_DE_003723-11	ende	It is the most important aspect to come.	Dies wird fortan der wichtigste Aspekt sein.	Das ist der wichtigste Aspekt, der dabei herauskommen muss.	ORG_WR_EN_DE_003723
_EN_DE_003752-01	ende	While I welcome the Commissioner 's statement, I regret the fact that the Commission 's work has not been more balanced recognising, for example, that there is a dark side to globalisation, too and has not been more ambitious.	Wenngleich ich die Erklärung des Kommissionsmitglieds begrüße, bedauere ich, dass die Arbeit der Kommission nicht ausgewogener gewesen ist indem sie zu dem Beispiel berücksichtigt, dass die Globalisierung auch ihre Schattenseiten hat und dass sie ihre Ziele nicht weiter gesteckt hat.	Ich begrüße zwar die Erklärung des Kommissars, bedauere jedoch, dass die Arbeit der Kommission nicht ausgewogener war und beispielsweise nicht anerkannt hat, dass die Globalisierung auch eine Schattenseite hat, und dass sie nicht ehrgeiziger war.	ORG_WR_EN_DE_003752
_EN_DE_003752-02	ende	Why did the Commission not take up Mr Verhofstadt 's suggestion that we should have a G8 not based on wealth and composed of the richest nations, but based on population and composed of the world 's major regional bodies, thereby involving the African Union, Mercosur, the South Asian Area of Regional Cooperation (SAARC) and so on?	Warum hat die Kommission denn den Vorschlag von Herrn Verhofstadt nicht aufgegriffen, wonach das Kriterium für die Zugehörigkeit zu der G8 nicht der Reichtum sein sollte und ihr nicht nur die wohlhabendsten Staaten angehören sollten, sondern vielmehr das Kriterium der Bevölkerungszahl gilt und die größten regionalen Vereinigungen der Welt vertreten wären, so unter anderem die Afrikanische Union, Mercosur, die Südasiatische Vereinigung für Regionale Zusammenarbeit (SAARC) und andere?	Warum hat die Kommission den Vorschlag von Herrn Verhofstadt nicht aufgegriffen, dass wir einen G8-Gipfel nicht auf der Grundlage des Wohlstands und unter Beteiligung der reichsten Nationen, sondern auf der Grundlage der Bevölkerungszahl und unter Beteiligung der wichtigsten regionalen Organisationen der Welt, darunter die Afrikanische Union, der Mercosur, die Südasiatische Vereinigung für regionale Zusammenarbeit (SAARC) usw., veranstalten sollten?	ORG_WR_EN_DE_003752
_EN_DE_003752-03	ende	Globalism has led to a world of interconnected communities.	Die Globalisierung hat zu einer Welt der miteinander verbundenen Gemeinschaften geführt.	Die Globalisierung hat zu einer Welt miteinander verbundener Gemeinschaften geführt.	ORG_WR_EN_DE_003752
_EN_DE_003752-04	ende	Technology and language learning have transformed our ability to communicate.	Die moderne Technik und das Erlernen von Fremdsprachen haben unsere Kommunikationsfähigkeiten verändert.	Technologie und Sprachenlernen haben unsere Kommunikationsfähigkeit verändert.	ORG_WR_EN_DE_003752
_EN_DE_003752-05	ende	Trade and investment have changed our economic perspectives and vastly increased our wealth.	Handel und Investitionen haben unsere wirtschaftlichen Perspektiven verändert und unseren Reichtum beträchtlich erhöht.	Handel und Investitionen haben unsere wirtschaftlichen Perspektiven verändert und unseren Wohlstand enorm gesteigert.	ORG_WR_EN_DE_003752
_EN_DE_003752-06	ende	Travel has opened up new horizons and new opportunities for human contact.	Das Reisen hat unseren Horizont erweitert und neue Möglichkeiten zu persönlichen Kontakten geschaffen.	Das Reisen hat neue Horizonte und neue Möglichkeiten für zwischenmenschliche Kontakte eröffnet.	ORG_WR_EN_DE_003752
_EN_DE_003752-07	ende	And yet all this has not come without a cost, because criminals have organised themselves into global networks; humankind 's damage to our natural environment threatens the future viability of life on our planet; and powerlessness and alienation are restricting opportunities for far too many to develop their own abilities and to improve the lot of themselves and their families.	Dennoch sind damit auch Nachteile verbunden, da sich Kriminelle in globalen Netzwerken organisieren konnten, die Zerstörung der Umwelt durch den Menschen künftiges Leben auf unserem Planeten gefährdet, und Machtlosigkeit und Verfremdung zu viele Menschen in ihren Möglichkeiten einschränken, als dass sie ihre Fähigkeiten entwickeln und ihre Lebenssituation bzw. die ihrer Familien verbessern könnten.	Und doch hat all dies seinen Preis, denn Kriminelle haben sich zu globalen Netzwerken zusammengeschlossen; die von den Menschen verursachten Schäden an unserer natürlichen Umwelt bedrohen die Zukunftsfähigkeit des Lebens auf unserem Planeten; und Machtlosigkeit und Entfremdung schränken die Möglichkeiten viel zu vieler Menschen ein, ihre eigenen Fähigkeiten zu entwickeln und ihr Schicksal und das ihrer Familien zu verbessern.	ORG_WR_EN_DE_003752
_EN_DE_003752-08	ende	History, Mr President, suggests that if the world were truly a global village, many more would be shocked by the misery of the poor.	Die Geschichte zeigt, Herr Präsident, dass, wenn die Welt inzwischen tatsächlich ein globales Dorf wäre, viel mehr Menschen über das Elend der Armen schockiert wären.	Die Geschichte, Herr Präsident, zeigt, dass, wenn die Welt wirklich ein globales Dorf wäre, viel mehr Menschen über das Elend der Armen schockiert wären.	ORG_WR_EN_DE_003752
_EN_DE_003752-09	ende	Of 6 billion human beings, half are living on less than EUR 2 per day and 800 million are going to sleep hungry every night.	Von den sechs Milliarden Menschen auf der Erde muss die Hälfte mit weniger als 2 EUR pro Tag auskommen und 800 Millionen gehen jeden Abend hungrig schlafen.	Von 6 Milliarden Menschen leben die Hälfte von weniger als 2 Euro pro Tag, und 800 Millionen gehen jeden Abend hungrig zu Bett.	ORG_WR_EN_DE_003752
_EN_DE_003752-10	ende	I say, therefore, to our friends on the Right that yes, the market economy, if intelligently regulated, is the most powerful instrument known to mankind to lift people out of poverty.	Daher sage ich zu unseren Freunden auf der rechten Seite: Ja, die Marktwirtschaft ist, wenn sie umsichtig reguliert wird, das mächtigste, der Menschheit bekannte Instrument, um Menschen von Armut zu befreien.	Ich sage daher unseren Freunden auf der rechten Seite: Ja, die Marktwirtschaft ist, wenn sie intelligent reguliert wird, das mächtigste Instrument, das die Menschheit kennt, um Menschen aus der Armut zu befreien.	ORG_WR_EN_DE_003752
_EN_DE_003752-11	ende	That we have not yet learned to use it properly, however, is shown by financial crises, by environmental degradation and by the continued spread of preventable disease.	Dennoch zeigen Finanzkrisen, Umweltverschmutzung und die unaufhörliche Ausbreitung verhütbarer Krankheiten, dass wir noch immer nicht gelernt haben, vernünftig damit umzugehen.	Dass wir jedoch noch nicht gelernt haben, sie richtig einzusetzen, zeigen Finanzkrisen, Umweltzerstörung und die anhaltende Ausbreitung vermeidbarer Krankheiten.	ORG_WR_EN_DE_003752
_EN_DE_003752-12	ende	Moreover, our failure to reach 0.7% of GDP in development aid is depriving the poor of EUR 100 billion per annum.	Da wir es außerdem immer noch nicht geschafft, haben 0,7 % unseres BIP für Entwicklungshilfe ausgeben, enthalten wir den Armen jährlich 100 Mrd. EUR vor.	Darüber hinaus entgehen den Armen jährlich 100 Milliarden Euro, weil wir es nicht schaffen, 0,7 % des BIP für Entwicklungshilfe aufzuwenden.	ORG_WR_EN_DE_003752
_EN_DE_003752-13	ende	I say to the Left that we need to reform our trade policies because aid and debt relief for developing countries without access to our markets can be nothing more than a palliative.	Und der Linken sage ich, dass wir unsere Handelspolitik reformieren müssen, denn Entwicklungshilfe und Schuldenerlass für Entwicklungsländer können nichts weiter als ein Linderungsmittel sein, wenn ihnen der Zugang zu unseren Märkten verwehrt wird.	Der Linken sage ich, dass wir unsere Handelspolitik reformieren müssen, denn Hilfe und Schuldenerlass für Entwicklungsländer ohne Zugang zu unseren Märkten können nur ein Notbehelf sein.	ORG_WR_EN_DE_003752
_EN_DE_003752-14	ende	To the Greens I would say that access to scientific progress is also important.	Den Grünen würde ich sagen, dass auch der Zugang zu wissenschaftlichem Fortschritt von Bedeutung ist.	Den Grünen möchte ich sagen, dass auch der Zugang zu wissenschaftlichem Fortschritt wichtig ist.	ORG_WR_EN_DE_003752
_EN_DE_003752-15	ende	It is the key to better nutrition, to improved health and life expectancy and to rising living standards.	Darin liegt nämlich der Schlüssel zu besserer Ernährung, verbessertem Gesundheitszustand und höherer Lebenserwartung.	Er ist der Schlüssel zu besserer Ernährung, besserer Gesundheit und Lebenserwartung sowie zu steigendem Lebensstandard.	ORG_WR_EN_DE_003752
_EN_DE_003752-16	ende	We must not starve the developing world of the benefits of innovation.	Wir dürfen den Entwicklungsländern nicht die Vorteile von Innovationen vorenthalten.	Wir dürfen den Entwicklungsländern nicht die Vorteile der Innovation vorenthalten.	ORG_WR_EN_DE_003752
_EN_DE_003752-17	ende	The challenge to humankind is to establish effective instruments of international government.	Die Menschheit steht daher vor der großen Aufgabe, wirksame Instrumente für globales Regieren zu schaffen.	Die Herausforderung für die Menschheit besteht darin, wirksame Instrumente der internationalen Regierungsführung zu schaffen.	ORG_WR_EN_DE_003752
_EN_DE_003752-18	ende	The United Nations, the international financial institutions, NATO, etc. have not succeeded as much as they should.	Die Vereinten Nationen, die internationalen Finanzinstitutionen, die NATO usw. waren nicht so erfolgreich, wie sie es hätten sein sollen.	Die Vereinten Nationen, die internationalen Finanzinstitutionen, die NATO usw. haben nicht so viel erreicht, wie sie sollten.	ORG_WR_EN_DE_003752
_EN_DE_003752-19	ende	Yet, in the European Union we may have a model for wider global governance.	Die Europäische Union jedoch könnte als Vorbild für eine umfassende Global Governance dienen.	Doch in der Europäischen Union haben wir möglicherweise ein Modell für eine umfassendere globale Regierungsführung.	ORG_WR_EN_DE_003752
_EN_DE_003752-20	ende	We need from our current leaders vision and commitment such as that shown by the founders of the Union.	Wir benötigen daher von unseren jetzigen Staats- und Regierungschefs Visionen und Engagement, so wie dies von den Gründungsvätern der Union gezeigt wurde.	Wir brauchen von unseren derzeitigen Führungskräften Visionen und Engagement, wie sie die Gründer der Union gezeigt haben.	ORG_WR_EN_DE_003752
_EN_DE_003752-21	ende	It involves the self-confidence to engage with the world economic forum, the world social forum and others and the self-confidence to say to our friends in the United States that their legitimate sense of vulnerability after 11 September should not lead them in a unilateralist direction whether in matters relating to military or economic security, the environment or fighting crime.	Dazu gehört genug Selbstbewusstsein, um mit dem Weltwirtschaftsforum, dem Weltsozialforum und anderen in Beziehung zu treten und genug Selbstbewusstsein, um unseren Freunden in den USA zu sagen, dass sie sich durch ihr berechtigtes Gefühl von Verletzlichkeit nach dem 11. September nicht in eine unilateralistische Richtung lenken lassen sollten, und zwar unabhängig davon, ob es sich um militärische oder wirtschaftliche Sicherheit, die Umwelt oder die Verbrechensbekämpfung handelt.	Dazu gehört das Selbstbewusstsein, sich im Weltwirtschaftsforum, im Weltsozialforum und anderen Gremien zu engagieren, und das Selbstbewusstsein, unseren Freunden in den Vereinigten Staaten zu sagen, dass ihr berechtigtes Gefühl der Verletzlichkeit nach dem 11. September sie nicht in eine unilateralistische Richtung führen sollte, sei es in Fragen der militärischen oder wirtschaftlichen Sicherheit, der Umwelt oder der Verbrechensbekämpfung.	ORG_WR_EN_DE_003752
_EN_DE_003752-22	ende	Global problems require global solutions.	Globale Probleme erfordern globale Lösungen.	Globale Probleme erfordern globale Lösungen.	ORG_WR_EN_DE_003752
_EN_DE_004321-01	ende	In November last year the Committee on Legal Affairs and the Internal Market instigated a public hearing on timeshares and a number of my constituents were able to come and explain their experiences directly to that hearing.	Im November vergangenen Jahres wurde von dem Ausschuss für Recht und Binnenmarkt eine öffentliche Anhörung über das Thema Teilnutzungsrechte an Immobilien initiiert, an der mehrere Bürger aus meinem Wahlkreis teilnahmen, um direkt über ihre Erfahrungen zu berichten.	Im November letzten Jahres hat der Ausschuss für Recht und Binnenmarkt eine öffentliche Anhörung zum Thema Timesharing initiiert, bei der einige meiner Wähler ihre Erfahrungen direkt vorbringen konnten.	ORG_WR_EN_DE_004321
_EN_DE_004321-02	ende	I an dem very happy to say that many of the problems raised at the hearing, both in the oral presentations and the written dossier of evidence I submitted at the time, have been addressed.	Ich freue mich, dass ich sagen kann, dass viele der Probleme mittlerweile beseitigt werden konnten, die bei dieser Anhörung sowohl in den mündlichen Berichten als auch in dem schriftlichen Bericht, den ich damals vorgelegt hatte, angesprochen wurden.	Ich freue mich sehr, dass viele der bei der Anhörung angesprochenen Probleme, sowohl in den mündlichen Vorträgen als auch in den schriftlichen Unterlagen, die ich damals vorgelegt habe, angegangen wurden.	ORG_WR_EN_DE_004321
_EN_DE_004321-03	ende	A particular concern has been the increase in holiday club, or points club operations, which, by the very nature of their membership rules, take advantage of current legislation, which does not cover contracts of under three years.	Ein besonderes Problem ist die Zunahme der Zahl von Ferienklubs oder Punktesystemen, die durch die Art ihrer Mitgliedschaftsbestimmungen die bestehende Gesetzgebung ausnutzen, in der keine Regelungen für Verträge mit einer Laufzeit von unter drei Jahren vorgesehen sind.	Ein besonderes Anliegen war die Zunahme von Ferienclubs oder Punkteclubs, die aufgrund ihrer Mitgliedschaftsregeln die derzeitige Gesetzgebung ausnutzen, die Verträge mit einer Laufzeit von weniger als drei Jahren nicht abdeckt.	ORG_WR_EN_DE_004321
_EN_DE_004321-04	ende	I would therefore commend to the House the proposal to cover all contracts of this nature, thus shutting off the loophole that currently exists.	Ich möchte dem Haus daher den Vorschlag empfehlen, der die Erfassung aller derartigen Verträge vorsieht, um so das derzeit bestehende Schlupfloch zu schließen.	Ich möchte daher dem Haus den Vorschlag empfehlen, alle Verträge dieser Art abzudecken und damit die derzeit bestehende Lücke zu schließen.	ORG_WR_EN_DE_004321
