base_seg_id	lpair	source	ht	mt	src_doc_id
_EN_DE_002715-02	ende	At the moment we have a very confusing set of different rules and regulations and it is clear from complaints to many of us and to Parliament 's Petitions Committee that clear advice is not always forthcoming from the appropriate authorities, even in Member States themselves.	Im Moment haben wir ein Paket sehr verwirrender, unterschiedlicher Regelungen und Verordnungen, und aus den Beschwerden, die an viele von uns und an den Petitionsausschuss des Parlaments herangetragen werden, geht hervor, dass selbst die zuständigen Behörden in den Mitgliedstaaten nicht immer richtig beraten.	Derzeit gibt es eine Vielzahl unterschiedlicher Vorschriften und Regelungen, die sehr verwirrend sind, und aus den Beschwerden, die bei vielen von uns und beim Petitionsausschuss des Parlaments eingehen, geht klar hervor, dass die zuständigen Behörden selbst in den Mitgliedstaaten nicht immer klare Auskünfte erteilen.	ORG_WR_EN_DE_002715
_EN_DE_002715-03	ende	The apparent anomalies have not helped either in social security coordination and entitlements, even different definitions as to what constitutes self-employment.	Auch bei der Koordinierung der Sozialversicherung und den versicherungsrechtlichen Ansprüchen waren diese Anomalien durchaus keine Hilfe, ja es bestehen sogar unterschiedliche Definitionen für selbstständige Erwerbstätigkeit.	Die offensichtlichen Unstimmigkeiten haben auch bei der Koordinierung der Sozialversicherung und den Ansprüchen nicht geholfen, ebenso wenig wie die unterschiedlichen Definitionen dessen, was unter Selbstständigkeit zu verstehen ist.	ORG_WR_EN_DE_002715
_EN_DE_002715-04	ende	The EURES network provides a very valuable resource for potential mobile workers.	Das EURES-Netzwerk ist eine besonders wertvolle Informationsquelle für potenzielle mobile Arbeitnehmer.	Das EURES-Netzwerk ist eine sehr wertvolle Ressource für potenzielle mobile Arbeitnehmer.	ORG_WR_EN_DE_002715
_EN_DE_002715-05	ende	It also provides a valuable, if underused, resource for employers.	Auch für Arbeitgeber kann es sehr wertvoll sein, wenngleich es zu wenig genutzt wird.	Es stellt auch eine wertvolle, wenn auch zu wenig genutzte Ressource für Arbeitgeber dar.	ORG_WR_EN_DE_002715
_EN_DE_002715-06	ende	Many small and medium-sized enterprises do not have the capacity or experience to carry out their cross-border recruitment.	Viele kleine und mittlere Unternehmen haben nicht die Kapazität oder die Erfahrung, ihre Arbeitskräfte grenzüberschreitend anzuwerben.	Viele kleine und mittlere Unternehmen verfügen nicht über die Kapazitäten oder die Erfahrung, um grenzüberschreitende Einstellungen vorzunehmen.	ORG_WR_EN_DE_002715
_EN_DE_002715-07	ende	EURES has an important role for them and it is a great pity that employment and employers' organisations are not more involved in the development of these services.	EURES spielt für sie eine wichtige Rolle, und es ist sehr bedauerlich, dass Arbeitsvermittlungen und Unternehmerverbände nicht stärker bei der Entwicklung dieser Dienstleistungen tätig werden.	EURES spielt für sie eine wichtige Rolle, und es ist sehr bedauerlich, dass die Arbeits- und Arbeitgeberverbände nicht stärker in die Entwicklung dieser Dienste einbezogen werden.	ORG_WR_EN_DE_002715
_EN_DE_002715-08	ende	Up to now, it has been particularly important in border regions, but EURES still does not cover all such areas, which is regrettable.	Bisher war das besonders in Grenzregionen wichtig, aber EURES deckt bedauerlicherweise alle diese Gebiete noch nicht ab.	Bislang war es besonders in Grenzregionen von Bedeutung, aber EURES deckt immer noch nicht alle diese Gebiete ab, was bedauerlich ist.	ORG_WR_EN_DE_002715
_EN_DE_002715-09	ende	It is obvious, as others have said, that EURES needs to be adequately resourced, expanded and promoted if it is to meet its full potential and respond to the needs of individuals.	Wie bereits gesagt wurde, liegt es auf der Hand, dass EURES angemessen ausgestattet, erweitert und gefördert werden muss, wenn es seine Möglichkeiten voll ausschöpfen und den Bedürfnissen von Einzelpersonen Rechnung tragen soll.	Es ist offensichtlich, wie andere bereits gesagt haben, dass EURES mit ausreichenden Mitteln ausgestattet, ausgebaut und gefördert werden muss, wenn es sein volles Potenzial ausschöpfen und den Bedürfnissen der Menschen gerecht werden soll.	ORG_WR_EN_DE_002715
_EN_DE_002715-10	ende	We must also recognise that enlargement will bring additional and quite legitimate demands in terms of information.	Wir müssen auch daran denken, dass die Erweiterung zusätzliche und ganz legitime Forderungen in Bezug auf Informationen mit sich bringt.	Wir müssen auch erkennen, dass die Erweiterung zusätzliche und durchaus berechtigte Anforderungen an die Information mit sich bringen wird.	ORG_WR_EN_DE_002715
_EN_DE_002715-11	ende	We support the request for more detailed information to be provided and agree that multi-annual funding is essential to the smooth development of this services.	Wir unterstützen die Forderung nach detaillierteren Informationen und stimmen dem zu, dass eine mehrjährige Finanzierung für eine reibungslose Entwicklung dieser Dienste notwendig ist.	Wir unterstützen die Forderung nach detaillierteren Informationen und stimmen zu, dass eine mehrjährige Finanzierung für die reibungslose Entwicklung dieser Dienste unerlässlich ist.	ORG_WR_EN_DE_002715
_EN_DE_002715-12	ende	However, its task would be made much easier if Member States adopted a more determined and coherent approach to making free movement a reality rather than an ideal that they keep banging on about, but seem incapable of delivering.	Die Aufgabe wäre allerdings viel einfacher, wenn die Mitgliedstaaten entschlossener und einheitlicher an die Verwirklichung der Freizügigkeit herangehen würden, anstatt viel Gewese um ein Ideal zu machen, das sie aber nicht imstande sind herüberzubringen.	Ihre Aufgabe würde jedoch erheblich erleichtert, wenn die Mitgliedstaaten entschlossener und kohärenter vorgehen würden, um die Freizügigkeit zu verwirklichen, anstatt sie als Ideal zu propagieren, das sie zwar immer wieder betonen, aber offenbar nicht umsetzen können.	ORG_WR_EN_DE_002715
_EN_DE_002715-13	ende	There has to be positive action by governments in favour of enabling people to experience working elsewhere: Mrs Van Lancker has already refereed to the coordination of social security systems within this.	Es muss positive Aktionen seitens der Regierungen geben, um die Menschen in die Lage zu versetzen, Erfahrung mit der Arbeit andernorts zu sammeln: Frau Van Lancker hat hierbei bereits auf die Koordinierung der sozialen Sicherungssysteme Bezug genommen.	Die Regierungen müssen positive Maßnahmen ergreifen, um den Menschen die Möglichkeit zu geben, Arbeitserfahrungen im Ausland zu sammeln: Frau Van Lancker hat bereits auf die Koordinierung der Sozialversicherungssysteme in diesem Zusammenhang hingewiesen.	ORG_WR_EN_DE_002715
_EN_DE_002715-14	ende	There is also the question about dealing with tax problems for frontier workers.	Eine weitere Frage ist, wie man mit Steuerproblemen bei grenzüberschreitenden Arbeitnehmern umgeht.	Außerdem stellt sich die Frage nach der Lösung der Steuerprobleme für Grenzgänger.	ORG_WR_EN_DE_002715
_EN_DE_002715-15	ende	We still have enormous problems with adequate recognition of qualifications, particularly vocational qualifications.	Wir haben immer noch enorme Schwierigkeiten bei der entsprechenden Anerkennung von Qualifikationen, insbesondere von beruflichen Qualifikationen.	Wir haben nach wie vor enorme Probleme mit der angemessenen Anerkennung von Qualifikationen, insbesondere von beruflichen Qualifikationen.	ORG_WR_EN_DE_002715
_EN_DE_002715-16	ende	Members States must recognise that free movement is not a threat to them, it is not an inconvenience, it is a valuable way to increase understanding and to develop cooperation within the Union.	Die Mitgliedstaaten müssen begreifen, dass die Freizügigkeit keine Bedrohung für sie darstellt, sie ist nichts Lästiges, sondern ein wertvolles Mittel zu der besseren Verständigung und zu der Entwicklung der Zusammenarbeit innerhalb der Union.	Die Mitgliedstaaten müssen erkennen, dass die Freizügigkeit keine Bedrohung für sie darstellt, keine Unannehmlichkeit ist, sondern ein wertvolles Mittel, um das Verständnis zu verbessern und die Zusammenarbeit innerhalb der Union zu entwickeln.	ORG_WR_EN_DE_002715
