base_seg_id	lpair	source	ht	mt	src_doc_id
_EN_DE_004321-05	ende	Furthermore, I an dem pleased to see that we have proposed that the handing over of credit card details be subject to the same cooling-off period as a deposit by any other means.	Darüber hinaus begrüße ich unseren Vorschlag, dass für die Bekanntgabe von Einzelheiten über die Kreditkarte dieselbe Abkühlungszeit gelten sollte wie für andere Anzahlungen.	Darüber hinaus freue ich mich, dass wir vorgeschlagen haben, dass die Übermittlung von Kreditkartendaten derselben Widerrufsfrist unterliegen soll wie eine Anzahlung auf anderem Wege.	ORG_WR_EN_DE_004321
_EN_DE_004321-06	ende	I have heard in surgeries in my own constituency of stories of innocent holidaymakers unwittingly giving timeshare touts their credit card details, only to find on their return from holiday that significant amounts of money have been debited from their accounts.	Ich habe bei Sprechstunden in meinem Wahlkreis gehört, dass unschuldige Urlauber Schleppern der Timesharing-Branche völlig ahnungslos Kreditkartenangaben machten und nach der Rückkehr aus ihrem Urlaub feststellen mussten, dass erhebliche Summen von ihrem Konto abgebucht waren.	In meiner Wahlkreissprechstunde habe ich Geschichten von unschuldigen Urlaubern gehört, die unwissentlich Timeshare-Anbietern ihre Kreditkartendaten gegeben haben und nach ihrer Rückkehr aus dem Urlaub feststellen mussten, dass erhebliche Beträge von ihren Konten abgebucht worden waren.	ORG_WR_EN_DE_004321
_EN_DE_004321-07	ende	Similarly, it is also vital that once contracts have been definitively signed, consumers are adequately protected against unreasonable increases in maintenance costs and, in cases where there has been malpractice, holidaymakers have easy recourse to legal redress.	Wichtig ist auch, dass die Verbraucher nach der endgültigen Unterzeichnung von Verträgen ausreichend vor einem unangemessenen Anstieg der Unterhaltskosten geschützt werden und die Urlauber in den Fällen, in denen ein Missbrauch vorliegt, ohne großen Aufwand Entschädigungsansprüche geltend machen können.	Ebenso wichtig ist es, dass die Verbraucher nach der endgültigen Unterzeichnung eines Vertrags angemessen vor unangemessenen Erhöhungen der Unterhaltskosten geschützt sind und dass Urlauber in Fällen von Fehlverhalten leicht Rechtsmittel einlegen können.	ORG_WR_EN_DE_004321
_EN_DE_004321-08	ende	A significant hurdle to such redress is the cost of complainants undertaking often lengthy legal procedures in a country where they are not completely at ease with the process.	Eine große Hürde für die Erlangung von Schadenersatz sind die mit einer Klage verbundenen Kosten, die durch oft langwierige Gerichtsverfahren in einem anderen Land entstehen, mit dessen Verfahren die Geschädigten nicht vertraut sind.	Ein erhebliches Hindernis für solche Rechtsmittel sind die Kosten, die den Beschwerdeführern durch oft langwierige Gerichtsverfahren in einem Land entstehen, in dem sie mit den Verfahren nicht vollständig vertraut sind.	ORG_WR_EN_DE_004321
_EN_DE_004321-09	ende	We must therefore look at new ways of simplifying this procedure, perhaps allowing complainants to use their own national judicial systems if necessary.	Wir müssen daher nach neuen Wegen zu der Vereinfachung dieses Verfahrens suchen. Vielleicht wäre es eine Lösung, wenn die Verbraucher bei Beschwerden das Rechtssystem des eigenen Landes nutzen könnten, wenn dies nötig ist.	Wir müssen daher nach neuen Wegen suchen, um dieses Verfahren zu vereinfachen, indem wir den Beschwerdeführern gegebenenfalls die Möglichkeit geben, ihre eigenen nationalen Rechtssysteme in Anspruch zu nehmen.	ORG_WR_EN_DE_004321
_EN_DE_004321-10	ende	These measures represent essential steps towards genuine consumer protection for European holidaymakers purchasing this type of holiday.	Diese Maßnahmen sind wichtige Schritte auf dem Weg zu einem wirksamen Schutz der europäischen Urlauber, die diese Art von Urlaubsleistungen erwerben.	Diese Maßnahmen sind wesentliche Schritte hin zu einem echten Verbraucherschutz für europäische Urlauber, die diese Art von Urlaub buchen.	ORG_WR_EN_DE_004321
_EN_DE_004321-11	ende	However, the current report is not a complete solution to all problems.	Der vorliegende Bericht bietet jedoch keine Lösung für alle bestehenden Probleme.	Der vorliegende Bericht ist jedoch keine vollständige Lösung für alle Probleme.	ORG_WR_EN_DE_004321
_EN_DE_004321-12	ende	I hope that Members will be able to support my amendment to extend the cooling-off period to 28 calendar days from its current 10.	Ich hoffe, dass die Mitglieder meinen Änderungsantrag zu der Verlängerung der Abkühlungszeit von derzeit 10 auf 28 Kalendertage unterstützen können.	Ich hoffe, dass die Abgeordneten meinen Änderungsantrag unterstützen werden, die Widerrufsfrist von derzeit 10 auf 28 Kalendertage zu verlängern.	ORG_WR_EN_DE_004321
_EN_DE_004321-13	ende	This would give a real opportunity for people to consider, in the cold light of day when they return from holiday, whether they wish to go ahead with their purchase.	Auf diese Weise hätten die Betroffenen die Möglichkeit, nach der Rückkehr aus ihrem Urlaub alle Fakten kühl und sachlich zu prüfen und zu entscheiden, ob sie den geplanten Kauf tatsächlich abschließen wollen.	Dies würde den Menschen eine echte Möglichkeit geben, nach ihrer Rückkehr aus dem Urlaub in aller Ruhe zu überlegen, ob sie ihren Kauf tätigen möchten.	ORG_WR_EN_DE_004321
_EN_DE_004321-14	ende	I hope now that the Commission can come forward with appropriate proposals for legislation as quickly as possible so that our EU citizens can enjoy all forms of timeshare holidays in complete peace of mind.	Ich hoffe, dass die Kommission so schnell wie möglich geeignete Vorschläge für Rechtsvorschriften vorlegen kann, damit unsere EU-Bürger alle Formen des Timesharing-Urlaubs ganz beruhigt genießen können.	Ich hoffe nun, dass die Kommission so schnell wie möglich geeignete Legislativvorschläge vorlegen kann, damit unsere EU-Bürger alle Formen von Timesharing-Urlauben in aller Ruhe genießen können.	ORG_WR_EN_DE_004321
_EN_DE_000131-01	ende	I look forward to working cooperatively with her.	Ich freue mich auf die kooperative Zusammenarbeit mit ihr.	Ich freue mich auf die Zusammenarbeit mit ihr.	ORG_WR_EN_DE_000131
_EN_DE_000131-02	ende	I cannot, however, let the information that I have just received about the nuclear accident in South Korea go unrecognised.	Ich kann nicht umhin, Ihnen die Meldung weiterzugeben, die ich eben über einen Atomunfall in Süd-Korea erhalten habe.	Ich kann jedoch die Informationen, die ich gerade über den Atomunfall in Südkorea erhalten habe, nicht unkommentiert lassen.	ORG_WR_EN_DE_000131
_EN_DE_000131-03	ende	I was very shocked and saddened to hear of the deaths of 22 workers, apparently as the result of a heavy water accident.	Ich war sehr betroffen über die Nachricht, daß 22 Arbeiter bei einem Unfall getötet worden sind, bei dem offensichtlich schweres Wasser ausgetreten ist.	Ich war sehr schockiert und traurig, als ich vom Tod von 22 Arbeitern hörte, offenbar infolge eines Unfalls mit schwerem Wasser.	ORG_WR_EN_DE_000131
_EN_DE_000131-04	ende	That underlines what we are trying to do here today and the need for changes in energy policy and in the budget for energy policy.	Dieser Unfall macht deutlich, wie wichtig das heutige Thema ist und wie dringend wir einen Wandel in der Energiepolitik sowie bei der Bereitstellung von Haushaltsmitteln für die Energiepolitik brauchen.	Das unterstreicht, was wir heute hier versuchen, und die Notwendigkeit von Änderungen in der Energiepolitik und im Haushalt für die Energiepolitik.	ORG_WR_EN_DE_000131
_EN_DE_000131-05	ende	SAVE is the only Community-wide programme dedicated to promoting the rational use of energy.	SAVE ist das einzige gemeinschaftsweite Programm zu der Förderung der rationellen Nutzung von Energie.	SAVE ist das einzige gemeinschaftsweite Programm, das sich der Förderung der rationellen Energienutzung widmet.	ORG_WR_EN_DE_000131
_EN_DE_000131-06	ende	SAVE II focuses on the non-technical elements, helping to build energy efficiency infrastructure, and therefore does not pay for hardware investments.	Im Programm SAVE II stehen nichttechnische Elemente in dem Mittelpunkt, mit deren Hilfe eine Infrastruktur der Energieeffizienz aufgebaut werden soll.	SAVE II konzentriert sich auf die nichttechnischen Elemente, trägt zum Aufbau einer energieeffizienten Infrastruktur bei und finanziert daher keine Investitionen in Hardware.	ORG_WR_EN_DE_000131
_EN_DE_000131-08	ende	The purpose of the programme is rather to create an environment in which investments and energy efficiency will be promoted and where energy efficiency will be recognised as a market opportunity.	Der Zweck des Programms besteht vielmehr darin, ein günstiges Umfeld für Investitionen und Energieeffizienz zu schaffen, in dem der rationelle Einsatz von Energie als Marktchance betrachtet wird.	Das Programm zielt vielmehr darauf ab, ein Umfeld zu schaffen, in dem Investitionen und Energieeffizienz gefördert werden und Energieeffizienz als Marktchance anerkannt wird.	ORG_WR_EN_DE_000131
_EN_DE_000131-09	ende	We have heard about the difficulties of competition and renewable energy, but energy saving also saves money and, therefore, is a good investment all round.	Die Probleme in dem Zusammenhang mit der Wettbewerbsfähigkeit erneuerbarer Energien wurden erwähnt, die Einsparung von Energie führt jedoch auch zu der Einsparung von Geld und ist daher rundum eine gute Investition.	Wir haben von den Schwierigkeiten des Wettbewerbs und der erneuerbaren Energien gehört, aber Energiesparen spart auch Geld und ist daher in jeder Hinsicht eine gute Investition.	ORG_WR_EN_DE_000131
_EN_DE_000131-10	ende	The SAVE programme was thoroughly and positively evaluated in 1994.	Das Programm SAVE wurde in dem Jahre 1994 sorgfältig evaluiert und für positiv befunden.	Das SAVE-Programm wurde 1994 gründlich und positiv bewertet.	ORG_WR_EN_DE_000131
_EN_DE_000131-11	ende	I congratulate the Commission on the way it was run: credit where credit is due.	Ich gratuliere der Kommission zu der Durchführung des Programms: Ehre, wem Ehre gebührt.	Ich gratuliere der Kommission zu der Art und Weise, wie es durchgeführt wurde: Ehre, wem Ehre gebührt.	ORG_WR_EN_DE_000131
_EN_DE_000131-12	ende	This House gives kicks to the Commission when it sees programmes badly run.	Die Kommission wird von diesem Haus gerügt, wenn man mit der Durchführung von Programmen unzufrieden ist.	Dieses Haus kritisiert die Kommission, wenn es Programme sieht, die schlecht durchgeführt werden.	ORG_WR_EN_DE_000131
_EN_DE_000131-13	ende	When a programme is well run and has been evaluated as such, we must also give it credit.	Wenn ein Programm gut durchgeführt und die Durchführung als gut bewertet wird, müssen wir dies ebenfalls würdigen.	Wenn ein Programm gut durchgeführt und als solches bewertet wurde, müssen wir es auch würdigen.	ORG_WR_EN_DE_000131
_EN_DE_000131-14	ende	The evaluation highlighted SAVE as a valuable policy instrument to promote energy efficiency but stressed that a clear and consistent strategy for pilot actions was required; that dissemination of results is the key to long-term success; and that long-term effectiveness requires better on-going monitoring and impact analysis.	Im Evaluierungsbericht wird SAVE als wertvolles politisches Instrument zu der Förderung der Energieeffizienz bezeichnet, es wurde jedoch betont, daß eine klare und einheitliche Strategie für Pilotprojekte erforderlich sei, daß die Veröffentlichung von Ergebnissen der Schlüssel für den langfristigen Erfolg sei und für die langfristige Wirksamkeit eine bessere fortlaufende Überwachung und eine Umweltverträglichkeitsprüfung erforderlich sei.	Die Bewertung hob SAVE als wertvolles politisches Instrument zur Förderung der Energieeffizienz hervor, betonte jedoch, dass eine klare und kohärente Strategie für Pilotmaßnahmen erforderlich sei, dass die Verbreitung der Ergebnisse der Schlüssel zum langfristigen Erfolg sei und dass eine langfristige Wirksamkeit eine bessere laufende Überwachung und Wirkungsanalyse erfordere.	ORG_WR_EN_DE_000131
_EN_DE_000131-15	ende	The evaluation also showed that SAVE actions will also indirectly lead to the achievement of the objectives of the non-nuclear energy R[amp]D programme through the creation of a positive environment for the dissemination and implementation of new technology in renewable energies.	Bei der Evaluierung zeigte sich außerdem, daß mit den Maßnahmen in dem Rahmen des SAVE-Programms indirekt die Ziele des Forschungs- und Entwicklungsprogramms auf dem Gebiet der nichtnuklearen Energie erreicht werden können, weil dadurch ein positives Umfeld für die Verbreitung und den Einsatz neuer Technologien für erneuerbare Energieträger geschaffen wird.	Die Bewertung zeigte auch, dass SAVE-Maßnahmen indirekt zur Erreichung der Ziele des F[amp]E-Programms für nichtnukleare Energien beitragen werden, indem sie ein positives Umfeld für die Verbreitung und Umsetzung neuer Technologien im Bereich der erneuerbaren Energien schaffen.	ORG_WR_EN_DE_000131
_EN_DE_000131-16	ende	The amendments proposed by this report are a direct result of this evaluation.	Die in dem Bericht vorgeschlagenen Änderungsanträge ergeben sich unmittelbar aus der Evaluierung.	Die in diesem Bericht vorgeschlagenen Änderungen sind ein direktes Ergebnis dieser Bewertung.	ORG_WR_EN_DE_000131
_EN_DE_000131-17	ende	Energy efficiency means lower consumption, the conservation of non-renewable energy sources and reduced dependence on energy imports, but most of all it means lower levels of environmental pollution from harmful substances such as CO2, one of the major causes of the greenhouse effect.	Energieeffizienz bedeutet geringeren Verbrauch, die Erhaltung nichterneuerbarer Energieträger und geringere Abhängigkeit von Energieeinfuhren, vor allem bedeutet sie jedoch ein geringeres Maß an Umweltverschmutzung durch Schadstoffe wie CO2, einem der Hauptverursacher des Treibhauseffekts.	Energieeffizienz bedeutet einen geringeren Verbrauch, die Schonung nicht erneuerbarer Energiequellen und eine geringere Abhängigkeit von Energieimporten, vor allem aber eine geringere Umweltverschmutzung durch Schadstoffe wie CO2, eine der Hauptursachen des Treibhauseffekts.	ORG_WR_EN_DE_000131
_EN_DE_000131-18	ende	The European Parliament has often underlined the importance of energy-efficient actions and the Council has also emphasised the need for energy savings and a reduction in CO2 emissions in a series of resolutions.	Vom Europäischen Parlament ist die Bedeutung von Maßnahmen zu dem rationelleren Energieeinsatz wiederholt unterstrichen worden, und auch der Rat hat die Notwendigkeit von Energieeinsparungen und einer Senkung der CO2-Emissionen in einer Reihe von Entschließungen bekräftigt.	Das Europäische Parlament hat wiederholt die Bedeutung energieeffizienter Maßnahmen hervorgehoben, und auch der Rat hat in einer Reihe von Entschließungen die Notwendigkeit von Energieeinsparungen und einer Verringerung der CO2-Emissionen betont.	ORG_WR_EN_DE_000131
_EN_DE_000131-19	ende	However, these announcements have been followed up by very modest proposals.	Diesen Ankündigungen folgten jedoch nur sehr bescheidene Vorschläge.	Auf diese Ankündigungen folgten jedoch nur sehr bescheidene Vorschläge.	ORG_WR_EN_DE_000131
_EN_DE_000131-20	ende	The energy savings targets will, in all likelihood, not be achieved by the means foreseen in the SAVE II programme.	Die festgelegten Ziele für die Energieeinsparung werden aller Wahrscheinlichkeit nach mit den in dem Rahmen des Programms SAVE II vorgesehenen Mitteln nicht erreicht.	Die Energieeinsparungsziele werden aller Wahrscheinlichkeit nach mit den im SAVE-II-Programm vorgesehenen Mitteln nicht erreicht werden.	ORG_WR_EN_DE_000131
_EN_DE_000131-21	ende	As the Community has so far not been able to agree on what is probably the most effective instrument for the reduction of greenhouse gases namely, the taxation of energy consumption the Commission and the Council regard the SAVE II programme as an important and necessary instrument.	Da die Gemeinschaft bisher nicht in der Lage war, sich auf das wahrscheinlich wirksamste Instrument zu der Verringerung der Treibhausgase zu einigen, nämlich die Besteuerung des Energieverbrauchs, betrachten die Kommission und der Rat das Programm SAVE II als bedeutendes und notwendiges Instrument.	Da sich die Gemeinschaft bisher nicht auf das wahrscheinlich wirksamste Instrument zur Verringerung der Treibhausgase, nämlich die Besteuerung des Energieverbrauchs, einigen konnte, betrachten die Kommission und der Rat das SAVE-II-Programm als ein wichtiges und notwendiges Instrument.	ORG_WR_EN_DE_000131
_EN_DE_000131-22	ende	Why then make cuts in an already low budget?	Warum werden dann ohnehin knappe Haushaltsmittel nochmals gekürzt?	Warum also Kürzungen in einem ohnehin schon knappen Haushalt vornehmen?	ORG_WR_EN_DE_000131
_EN_DE_000131-23	ende	That is why I have restored the budget figures originally proposed by the Commission which were fully justified.	Ich habe deshalb die ursprünglich von der Kommission vorgesehenen und völlig gerechtfertigten Haushaltszahlen wieder eingesetzt.	Aus diesem Grund habe ich die ursprünglich von der Kommission vorgeschlagenen Haushaltszahlen wiederhergestellt, die voll und ganz gerechtfertigt waren.	ORG_WR_EN_DE_000131
_EN_DE_000131-24	ende	Bearing in mind the expected increase in the energy CO2 emissions and the low budget allocated to SAVE II it is rather unlikely that the internationally agreed objectives for reducing emissions could be achieved by this programme.	Angesichts des zu erwartenden Anstiegs der CO2-Emissionen und der für das Programm SAVE II bereitgestellten geringen Haushaltsmittel ist es wenig wahrscheinlich, daß die international vereinbarten Ziele für die Senkung der Emissionen durch dieses Programm erreicht werden können.	Angesichts des zu erwartenden Anstiegs der CO2-Emissionen im Energiebereich und des geringen Budgets für SAVE II ist es eher unwahrscheinlich, dass die international vereinbarten Ziele zur Emissionsreduzierung mit diesem Programm erreicht werden können.	ORG_WR_EN_DE_000131
_EN_DE_000131-25	ende	However, under the energy framework programme SAVE II offers an opportunity to reverse a trend.	Im Zuge des Energie-Rahmenprogramms bietet das Programm SAVE II jedoch eine Möglichkeit, den Trend umzukehren.	Im Rahmen des Energie-Rahmenprogramms bietet SAVE II jedoch die Möglichkeit, einen Trend umzukehren.	ORG_WR_EN_DE_000131
_EN_DE_000131-26	ende	Since at Member State level progress has stagnated, the responsibility for achieving energy efficiency targets and meeting reduction commitments now lies with the Community.	Da es auf der Ebene der Mitgliedstaaten hinsichtlich einer verbesserten Effizienz in dem Energiesektor keine Fortschritte gibt, liegt die Verantwortung für die Realisierung des Effizienzziels und die Einhaltung der Verpflichtungen zu der CO2-Senkung jetzt bei der Gemeinschaft.	Da auf Ebene der Mitgliedstaaten keine Fortschritte mehr erzielt werden, liegt die Verantwortung für die Erreichung der Energieeffizienzziele und die Erfüllung der Reduktionsverpflichtungen nun bei der Gemeinschaft.	ORG_WR_EN_DE_000131
_EN_DE_000131-27	ende	The Finnish presidency has therefore announced an action plan for energy efficiency during the second half of 1999.	Die finnische Ratspräsidentschaft hat daher angekündigt, in dem zweiten Halbjahr 1999 einen Aktionsplan zu der Energieeffizienz vorzulegen.	Die finnische Präsidentschaft hat daher für die zweite Hälfte des Jahres 1999 einen Aktionsplan für Energieeffizienz angekündigt.	ORG_WR_EN_DE_000131
_EN_DE_000131-28	ende	It is very welcome and important.	Dies ist äußerst wichtig und sehr begrüßenswert.	Dies ist sehr zu begrüßen und wichtig.	ORG_WR_EN_DE_000131
_EN_DE_000131-29	ende	The Commission argues in favour of setting a Community energy efficiency target.	Die Kommission befürwortet die Festsetzung eines Gemeinschaftsziels für die rationelle Verwendung von Energie.	Die Kommission spricht sich für die Festlegung eines Energieeffizienzziels für die Gemeinschaft aus.	ORG_WR_EN_DE_000131
_EN_DE_000131-30	ende	Given the approximately 1% annual improvement in energy efficiency in final consumption achieved so far, the Commission calls for a target of reducing energy intensity in final demand by a further percentage point per year.	Da bisher bei dem Endverbrauch eine Verbesserung um etwa 1 % jährlich erreicht wurde, fordert die Kommission ein Ziel für die Verringerung der Energieintensität bei der Endnachfrage um einen weiteren Prozentpunkt pro Jahr.	Angesichts der bisher erzielten jährlichen Verbesserung der Energieeffizienz beim Endverbrauch um etwa 1 % fordert die Kommission ein Ziel zur Verringerung der Energieintensität beim Endverbrauch um einen weiteren Prozentpunkt pro Jahr.	ORG_WR_EN_DE_000131
_EN_DE_000131-31	ende	Given our commitments, as already underlined, it is incomprehensible that the Commission could confine itself to such a target.	Angesichts unserer bereits erwähnten Verpflichtungen zu der Senkung der CO2-Emissionen ist es unverständlich, daß die Kommission sich auf ein solches Ziel beschränken sollte.	Angesichts unserer Verpflichtungen, wie bereits betont, ist es unverständlich, dass sich die Kommission auf ein solches Ziel beschränken könnte.	ORG_WR_EN_DE_000131
_EN_DE_000131-32	ende	A goal of a further one-and-a-half percentage points should be set in order to develop additional savings potential.	Ein Ziel von weiteren 1,5 Prozentpunkten sollte festgelegt werden, um zusätzliches Einsparungspotential zu entwickeln.	Es sollte ein Ziel von weiteren eineinhalb Prozentpunkten festgelegt werden, um zusätzliches Einsparpotenzial zu erschließen.	ORG_WR_EN_DE_000131
_EN_DE_000131-33	ende	As you know, Parliament agreed this at first reading.	Wie Sie wissen, hat das Parlament dem bei der ersten Lesung zugestimmt.	Wie Sie wissen, hat das Parlament dem in erster Lesung zugestimmt.	ORG_WR_EN_DE_000131
_EN_DE_000131-34	ende	I should just like to add two technical points.	Ich möchte noch zwei technische Gesichtspunkte erwähnen.	Ich möchte nur zwei technische Punkte hinzufügen.	ORG_WR_EN_DE_000131
_EN_DE_000131-35	ende	We have, on legal advice, improved the comitology amendments.	Im Ergebnis einer Rechtsberatung haben wir die Änderungsanträge zu der Komitologie verbessert.	Aufgrund rechtlicher Beratung haben wir die Komitologie-Änderungsanträge verbessert.	ORG_WR_EN_DE_000131
_EN_DE_000131-36	ende	Therefore we have replaced Amendment No 5 by a new Amendment No 13, and Amendment No 11 by a new Amendment No 12.	Daher haben wir Abänderungsantrag 5 durch einen neuen Abänderungsantrag 13 und Abänderungsantrag 11 durch einen neuen Abänderungsantrag 12 ersetzt.	Daher haben wir Änderungsantrag Nr. 5 durch einen neuen Änderungsantrag Nr. 13 und Änderungsantrag Nr. 11 durch einen neuen Änderungsantrag Nr. 12 ersetzt.	ORG_WR_EN_DE_000131
_EN_DE_000131-37	ende	This was on legal advice to improve the original amendments.	Dies geschah auf die juristische Empfehlung hin, die ursprünglichen Abänderungsanträge zu verbessern.	Dies geschah auf rechtliche Beratung hin, um die ursprünglichen Änderungsanträge zu verbessern.	ORG_WR_EN_DE_000131
_EN_DE_000131-38	ende	I hope that will be acceptable to everyone.	Ich hoffe, Sie alle können dem zustimmen.	Ich hoffe, dass dies für alle akzeptabel ist.	ORG_WR_EN_DE_000131
_EN_DE_002715-01	ende	There is no doubt that working abroad is increasingly popular for young people, in particular, and businesses are also looking to recruit from a wider field, but for this to be possible, people need to feel that they can have accurate, up-to-date information about what working in another Member State may entail, because that information provides them with a real choice as to whether they work elsewhere or not.	Zweifellos wird es vor allem unter jungen Leuten immer beliebter, in dem Ausland zu arbeiten, und auch die Unternehmen bemühen sich um Arbeitskräfte aus einem immer weiteren Umkreis. Doch dazu brauchen die Leute die Gewissheit, dass sie zutreffende, aktuelle Informationen darüber einholen können, was es denn heißt, in einem anderen Mitgliedstaat zu arbeiten, weil sie dann auch wirklich entscheiden können, ob sie anderswo arbeiten wollen oder nicht.	Es besteht kein Zweifel daran, dass das Arbeiten im Ausland insbesondere bei jungen Menschen immer beliebter wird und auch Unternehmen versuchen, Mitarbeiter aus einem größeren Einzugsgebiet zu rekrutieren. Damit dies jedoch möglich ist, müssen die Menschen das Gefühl haben, dass sie über genaue und aktuelle Informationen darüber verfügen, was die Arbeit in einem anderen Mitgliedstaat mit sich bringen kann, denn diese Informationen ermöglichen ihnen eine echte Entscheidung darüber, ob sie anderswo arbeiten möchten oder nicht.	ORG_WR_EN_DE_002715
